{"schema_version":"1.0","kind":"memory_candidate","id":"replace-with-stable-id","proposed_title":"","proposed_content":"","dedupe_key":"","classification":"project","importance":3,"confidence":0.5,"source_ids":["source-id"],"relationships":[],"possible_conflicts":[],"status":"candidate","captured_at":"2026-09-06T00:00:00Z","reviewed_at":null,"review_note":""}

